{
    "schema_version":  1,
    "ledger_id":  "official-client-interop",
    "classification":  "official_client_interop",
    "baseline_sha":  "b43e832fcc8000ed7287c7accc54e381db607f85",
    "features":  [
                     {
                         "feature_id":  "interop.acp.server",
                         "title":  "ACP server bridge",
                         "domain":  "acp",
                         "tier":  "tier_2",
                         "profile":  "client_interop",
                         "classification":  "official_client_interop",
                         "upstream_source":  {
                                                 "repository":  "openclaw/openclaw",
                                                 "paths":  [
                                                               "docs/cli/acp.md",
                                                               "src/acp/server.ts"
                                                           ]
                                             },
                         "status":  "implemented",
                         "acceptance_evidence":  {
                                                     "status":  "accepted",
                                                     "artifacts":  [
                                                                       {
                                                                           "path":  "crates/claw-acp/tests/subprocess_interop.rs",
                                                                           "test":  "debug_client_exercises_bridge_lifecycle_and_streaming"
                                                                       },
                                                                       {
                                                                           "path":  "crates/claw-acp/tests/subprocess_interop.rs",
                                                                           "test":  "debug_client_resumes_and_configures_a_session"
                                                                       }
                                                                   ],
                                                     "required":  "ACP stdio tests cover initialize, session lifecycle, prompts, cancel, streaming, modes, and permissions."
                                                 },
                         "last_verified_sha":  "b43e832fcc8000ed7287c7accc54e381db607f85",
                         "known_differences":  [
                                                   "Interoperability is exercised against a local pure-Rust ACP fixture rather than an external third-party agent.",
                                                   "The bounded bidirectional JSON-RPC peer is maintained in this crate instead of delegating transport behavior to an ACP runtime SDK."
                                               ],
                         "implementation_pointers":  [
                                                         {
                                                             "path":  "crates/claw-acp/src/bridge.rs",
                                                             "note":  "Implements the ACP stdio server bridge, request dispatch, lifecycle methods, streaming, cancellation, modes, and permissions."
                                                         },
                                                         {
                                                             "path":  "crates/claw-acp/src/protocol.rs",
                                                             "note":  "Implements bounded newline-delimited bidirectional JSON-RPC framing and connection-wide failure propagation."
                                                         }
                                                     ]
                     },
                     {
                         "feature_id":  "interop.acp.client",
                         "title":  "ACP debug client",
                         "domain":  "acp",
                         "tier":  "tier_2",
                         "profile":  "client_interop",
                         "classification":  "official_client_interop",
                         "upstream_source":  {
                                                 "repository":  "openclaw/openclaw",
                                                 "paths":  [
                                                               "docs/cli/acp.md",
                                                               "src/acp/client.ts"
                                                           ]
                                             },
                         "status":  "implemented",
                         "acceptance_evidence":  {
                                                     "status":  "accepted",
                                                     "artifacts":  [
                                                                       {
                                                                           "path":  "crates/claw-acp/tests/subprocess_interop.rs",
                                                                           "test":  "debug_client_exercises_bridge_lifecycle_and_streaming"
                                                                       },
                                                                       {
                                                                           "path":  "crates/claw-acp/tests/subprocess_interop.rs",
                                                                           "test":  "debug_client_resumes_and_configures_a_session"
                                                                       },
                                                                       {
                                                                           "path":  "crates/claw-acp/tests/subprocess_interop.rs",
                                                                           "test":  "debug_client_rejects_unsupported_protocol_version"
                                                                       }
                                                                   ],
                                                     "required":  "The Rust debug client negotiates and exercises the pinned ACP bridge lifecycle."
                                                 },
                         "last_verified_sha":  "b43e832fcc8000ed7287c7accc54e381db607f85",
                         "known_differences":  [
                                                   "Interoperability is exercised against a local pure-Rust ACP fixture rather than an external third-party agent."
                                               ],
                         "implementation_pointers":  [
                                                         {
                                                             "path":  "crates/claw-acp/src/debug_client.rs",
                                                             "note":  "Implements protocol negotiation, session lifecycle, prompt streaming, cancellation, permission handling, and subprocess-tree supervision."
                                                         }
                                                     ]
                     },
                     {
                         "feature_id":  "interop.acpx",
                         "title":  "ACPX harness runtime",
                         "domain":  "acp",
                         "tier":  "tier_2",
                         "profile":  "client_interop",
                         "classification":  "official_client_interop",
                         "upstream_source":  {
                                                 "repository":  "openclaw/openclaw",
                                                 "paths":  [
                                                               "extensions/acpx/src/runtime.ts",
                                                               "docs/tools/acp-agents-setup.md"
                                                           ]
                                             },
                         "status":  "implemented",
                         "acceptance_evidence":  {
                                                     "status":  "accepted",
                                                     "artifacts":  [
                                                                       {
                                                                           "path":  "crates/claw-acp/tests/acpx_interop.rs",
                                                                           "test":  "runtime_resolves_aliases_persists_sessions_and_completes_leases"
                                                                       },
                                                                       {
                                                                           "path":  "crates/claw-acp/tests/acpx_interop.rs",
                                                                           "test":  "registry_stdio_configuration_maps_to_exact_acp_mcp_shape"
                                                                       },
                                                                       {
                                                                           "path":  "crates/claw-acp/src/acpx.rs",
                                                                           "test":  "tests::permission_policy_is_fail_closed_and_allowlisted"
                                                                       },
                                                                       {
                                                                           "path":  "crates/claw-acp/src/acpx.rs",